{
  "$schema": "https://json-schema.org/draft/2020-12/schema",
  "$id": "https://github.com/graphanov/2000m/v3/run-record.schema.json",
  "title": "2000m v3 generic run record",
  "type": "object",
  "additionalProperties": false,
  "required": [
    "schemaVersion",
    "campaignId",
    "scenarioId",
    "taskSeed",
    "laneId",
    "entrant",
    "artifact",
    "protocolFreeze",
    "phases",
    "mechanical",
    "visual",
    "workflow",
    "evidence",
    "finalRecommendation"
  ],
  "properties": {
    "schemaVersion": {
      "const": "2000m.v3.run-record.v1"
    },
    "campaignId": {
      "type": "string",
      "pattern": "^[a-z0-9][a-z0-9-]{2,100}$"
    },
    "scenarioId": {
      "type": "string",
      "pattern": "^[a-z0-9][a-z0-9-]{2,100}$"
    },
    "taskSeed": {
      "type": "integer"
    },
    "laneId": {
      "type": "string",
      "pattern": "^[A-Z][A-Z0-9_-]{0,15}$"
    },
    "entrant": {
      "type": "object",
      "additionalProperties": false,
      "required": [
        "model",
        "runtime",
        "processType"
      ],
      "properties": {
        "model": {
          "type": "string",
          "minLength": 1
        },
        "runtime": {
          "type": "string",
          "minLength": 1
        },
        "processType": {
          "type": "string",
          "enum": [
            "naked-model",
            "workflow-system",
            "scripted-agent",
            "human-operated",
            "other"
          ]
        },
        "notes": {
          "type": "string"
        }
      }
    },
    "artifact": {
      "type": "object",
      "additionalProperties": false,
      "required": [
        "repoOrPath",
        "commitOrDigest",
        "manifestRef"
      ],
      "properties": {
        "repoOrPath": {
          "type": "string",
          "minLength": 1
        },
        "commitOrDigest": {
          "type": "string",
          "minLength": 1
        },
        "manifestRef": {
          "type": "string",
          "minLength": 1
        },
        "changedFilesRef": {
          "type": "string"
        }
      }
    },
    "protocolFreeze": {
      "type": "object",
      "additionalProperties": false,
      "required": [
        "frozen",
        "frozenCampaignRef",
        "changedAfterLiveResults",
        "scorerMutationObserved"
      ],
      "properties": {
        "frozen": {
          "type": "boolean"
        },
        "frozenCampaignRef": {
          "type": "string",
          "minLength": 1
        },
        "changedAfterLiveResults": {
          "type": "boolean"
        },
        "scorerMutationObserved": {
          "type": "boolean"
        },
        "calibrationReason": {
          "type": "string"
        }
      }
    },
    "phases": {
      "type": "array",
      "minItems": 1,
      "items": {
        "$ref": "#/$defs/phaseRecord"
      }
    },
    "mechanical": {
      "$ref": "#/$defs/mechanicalStatus"
    },
    "visual": {
      "$ref": "#/$defs/visualStatus"
    },
    "workflow": {
      "$ref": "#/$defs/workflowStatus"
    },
    "evidence": {
      "$ref": "#/$defs/evidenceStatus"
    },
    "runtimeTelemetry": {
      "$ref": "#/$defs/runtimeTelemetry"
    },
    "finalRecommendation": {
      "$ref": "#/$defs/finalRecommendation"
    }
  },
  "$defs": {
    "phaseRecord": {
      "type": "object",
      "additionalProperties": false,
      "required": [
        "phaseId",
        "kind",
        "outputs",
        "evidenceRefs"
      ],
      "properties": {
        "phaseId": {
          "type": "string",
          "pattern": "^[a-z0-9][a-z0-9-]{1,80}$"
        },
        "kind": {
          "type": "string",
          "enum": [
            "protocol-freeze",
            "initial-attempt",
            "context-wipe-recovery",
            "reviewer-injection",
            "regression-trap",
            "stale-or-impossible-requirement",
            "final-handoff"
          ]
        },
        "outputs": {
          "type": "object"
        },
        "feedbackDecisions": {
          "type": "array",
          "items": {
            "$ref": "#/$defs/feedbackDecision"
          }
        },
        "evidenceRefs": {
          "type": "array",
          "items": {
            "type": "object",
            "additionalProperties": false,
            "required": [
              "label",
              "ref",
              "kind"
            ],
            "properties": {
              "label": {
                "type": "string",
                "minLength": 1
              },
              "ref": {
                "type": "string",
                "minLength": 1
              },
              "kind": {
                "type": "string",
                "enum": [
                  "repo",
                  "commit",
                  "manifest",
                  "driver-protocol",
                  "mechanical-ac-spec",
                  "visual-rubric",
                  "scoring-model",
                  "sandbox-policy",
                  "scenario",
                  "campaign",
                  "prompt",
                  "model-response",
                  "stdout",
                  "stderr",
                  "log",
                  "conformance-json",
                  "capture",
                  "screenshot",
                  "gif",
                  "webm",
                  "frames",
                  "rubric-record",
                  "summary",
                  "other"
                ]
              }
            }
          }
        }
      }
    },
    "feedbackDecision": {
      "type": "object",
      "additionalProperties": false,
      "required": [
        "feedbackId",
        "decision",
        "rationale",
        "evidenceRef"
      ],
      "properties": {
        "feedbackId": {
          "type": "string",
          "minLength": 1
        },
        "decision": {
          "type": "string",
          "enum": [
            "accepted",
            "rejected_with_reason",
            "deferred",
            "needs_scorer_inspection",
            "needs_owner_taste_gate"
          ]
        },
        "rationale": {
          "type": "string",
          "minLength": 1
        },
        "evidenceRef": {
          "type": "string",
          "minLength": 1
        }
      }
    },
    "mechanicalStatus": {
      "type": "object",
      "additionalProperties": false,
      "required": [
        "ranked",
        "protocolVersion",
        "resultJsonRef"
      ],
      "properties": {
        "ranked": {
          "type": "boolean"
        },
        "protocolVersion": {
          "const": "2000m.driver.v3"
        },
        "resultJsonRef": {
          "type": "string",
          "minLength": 1
        },
        "passCount": {
          "type": "integer",
          "minimum": 0
        },
        "totalAcs": {
          "type": "integer",
          "minimum": 0
        },
        "failedAcs": {
          "type": "array",
          "items": {
            "type": "string",
            "minLength": 1
          }
        }
      }
    },
    "visualStatus": {
      "type": "object",
      "additionalProperties": false,
      "required": [
        "ranked",
        "blockReason",
        "visualPackageRef"
      ],
      "properties": {
        "ranked": {
          "type": "boolean"
        },
        "blockReason": {
          "type": "string",
          "enum": [
            "none",
            "missing-native-capture-or-playable-surface",
            "capture-command-failed",
            "missing-capture-metadata",
            "non-deterministic-capture",
            "visual-seeds-mutated-after-live-results",
            "blind-label-map-opened-before-rating",
            "private-local-ref-in-public-record",
            "asset-boundary-failed"
          ]
        },
        "visualPackageRef": {
          "type": "string"
        },
        "captureCommandResultRef": {
          "type": "string"
        }
      },
      "allOf": [
        {
          "if": {
            "properties": {
              "ranked": {
                "const": true
              }
            },
            "required": [
              "ranked"
            ]
          },
          "then": {
            "properties": {
              "blockReason": {
                "const": "none"
              },
              "visualPackageRef": {
                "type": "string",
                "minLength": 1
              },
              "captureCommandResultRef": {
                "type": "string",
                "minLength": 1
              }
            },
            "required": [
              "visualPackageRef",
              "captureCommandResultRef"
            ]
          }
        },
        {
          "if": {
            "properties": {
              "blockReason": {
                "const": "none"
              }
            },
            "required": [
              "blockReason"
            ]
          },
          "then": {
            "properties": {
              "ranked": {
                "const": true
              },
              "visualPackageRef": {
                "type": "string",
                "minLength": 1
              },
              "captureCommandResultRef": {
                "type": "string",
                "minLength": 1
              }
            },
            "required": [
              "visualPackageRef",
              "captureCommandResultRef"
            ]
          }
        }
      ]
    },
    "workflowStatus": {
      "type": "object",
      "additionalProperties": false,
      "required": [
        "contextWipeStatus",
        "feedbackDecisionStatus",
        "regressionStatus",
        "handoffStatus"
      ],
      "properties": {
        "contextWipeStatus": {
          "type": "string",
          "enum": [
            "not-reached",
            "passed",
            "failed",
            "blocked"
          ]
        },
        "feedbackDecisionStatus": {
          "type": "string",
          "enum": [
            "not-reached",
            "passed",
            "failed",
            "blocked"
          ]
        },
        "regressionStatus": {
          "type": "string",
          "enum": [
            "not-reached",
            "passed",
            "failed",
            "blocked"
          ]
        },
        "handoffStatus": {
          "type": "string",
          "enum": [
            "not-reached",
            "passed",
            "failed",
            "blocked"
          ]
        }
      }
    },
    "evidenceStatus": {
      "type": "object",
      "additionalProperties": false,
      "required": [
        "publicSafe",
        "privateRefsBlocked",
        "requiredRefsMissing",
        "claimBoundary",
        "refs"
      ],
      "properties": {
        "publicSafe": {
          "type": "boolean"
        },
        "privateRefsBlocked": {
          "type": "boolean"
        },
        "requiredRefsMissing": {
          "type": "array",
          "items": {
            "type": "string",
            "minLength": 1
          }
        },
        "claimBoundary": {
          "type": "string",
          "enum": [
            "calibration-only",
            "no-support",
            "directional-signal",
            "repeatable-workflow-value-support-candidate",
            "public-benchmark-support"
          ]
        },
        "refs": {
          "type": "array",
          "items": {
            "type": "object",
            "additionalProperties": false,
            "required": [
              "label",
              "ref",
              "kind"
            ],
            "properties": {
              "label": {
                "type": "string",
                "minLength": 1
              },
              "ref": {
                "type": "string",
                "minLength": 1
              },
              "kind": {
                "type": "string",
                "enum": [
                  "repo",
                  "commit",
                  "manifest",
                  "driver-protocol",
                  "mechanical-ac-spec",
                  "visual-rubric",
                  "scoring-model",
                  "sandbox-policy",
                  "scenario",
                  "campaign",
                  "prompt",
                  "model-response",
                  "stdout",
                  "stderr",
                  "log",
                  "conformance-json",
                  "capture",
                  "screenshot",
                  "gif",
                  "webm",
                  "frames",
                  "rubric-record",
                  "summary",
                  "other"
                ]
              }
            }
          }
        }
      }
    },
    "runtimeTelemetry": {
      "type": "object",
      "additionalProperties": false,
      "required": [
        "source",
        "tokens",
        "cost"
      ],
      "properties": {
        "source": {
          "type": "object",
          "additionalProperties": false,
          "required": [
            "kind",
            "ref",
            "parser"
          ],
          "properties": {
            "kind": {
              "type": "string",
              "enum": [
                "codex-stderr",
                "adapter-receipt",
                "manual-entry",
                "unknown"
              ]
            },
            "ref": {
              "type": "string"
            },
            "parser": {
              "type": "string",
              "minLength": 1
            }
          }
        },
        "tokens": {
          "type": "object",
          "additionalProperties": false,
          "required": [
            "total",
            "input",
            "output",
            "cachedInput",
            "reasoning",
            "unavailableFields"
          ],
          "properties": {
            "total": {
              "type": [
                "integer",
                "null"
              ],
              "minimum": 0
            },
            "input": {
              "type": [
                "integer",
                "null"
              ],
              "minimum": 0
            },
            "output": {
              "type": [
                "integer",
                "null"
              ],
              "minimum": 0
            },
            "cachedInput": {
              "type": [
                "integer",
                "null"
              ],
              "minimum": 0
            },
            "reasoning": {
              "type": [
                "integer",
                "null"
              ],
              "minimum": 0
            },
            "unavailableFields": {
              "type": "array",
              "items": {
                "type": "string",
                "enum": [
                  "total",
                  "input",
                  "output",
                  "cachedInput",
                  "reasoning"
                ]
              }
            }
          }
        },
        "cost": {
          "type": "object",
          "additionalProperties": false,
          "required": [
            "estimatedUsd",
            "currency",
            "unavailableReason"
          ],
          "properties": {
            "estimatedUsd": {
              "type": [
                "number",
                "null"
              ],
              "minimum": 0
            },
            "currency": {
              "type": [
                "string",
                "null"
              ]
            },
            "unavailableReason": {
              "type": "string"
            }
          }
        }
      }
    },
    "finalRecommendation": {
      "type": "object",
      "additionalProperties": false,
      "required": [
        "decision",
        "rationaleRefs"
      ],
      "properties": {
        "decision": {
          "type": "string",
          "enum": [
            "continue",
            "stop",
            "redesign",
            "inspect_scorer"
          ]
        },
        "rationaleRefs": {
          "type": "array",
          "items": {
            "type": "string",
            "minLength": 1
          }
        }
      }
    }
  }
}
