{
  "artifact": {
    "changedFilesRef": "v3/examples/workflow/evidence/summary.complete.md",
    "commitOrDigest": "sha256:0000000000000000000000000000000000000000000000000000000000000000",
    "manifestRef": "v3/fixtures/mechanical/valid-artifact/2000m.v3.json",
    "repoOrPath": "v3/fixtures/mechanical/valid-artifact"
  },
  "campaignId": "v3-workflow-calibration",
  "entrant": {
    "model": "fixture-model",
    "notes": "Calibration fixture only; not a contender result.",
    "processType": "scripted-agent",
    "runtime": "fixture-runtime"
  },
  "evidence": {
    "claimBoundary": "calibration-only",
    "privateRefsBlocked": false,
    "publicSafe": true,
    "refs": [
      {
        "kind": "summary",
        "label": "summary",
        "ref": "v3/examples/workflow/evidence/summary.complete.md"
      }
    ],
    "requiredRefsMissing": []
  },
  "finalRecommendation": {
    "decision": "inspect_scorer",
    "rationaleRefs": [
      "v3/WORKFLOW_RESILIENCE_PROTOCOL.md",
      "v3/EVIDENCE_AND_CLAIMS.md"
    ]
  },
  "laneId": "A",
  "mechanical": {
    "failedAcs": [],
    "passCount": 24,
    "protocolVersion": "2000m.driver.v3",
    "ranked": true,
    "resultJsonRef": "v3/fixtures/mechanical/out/valid-result.json",
    "totalAcs": 24
  },
  "phases": [
    {
      "evidenceRefs": [
        {
          "kind": "scenario",
          "label": "scenario",
          "ref": "v3/examples/workflow/scenarios/v3-workflow-calibration.scenario.json"
        }
      ],
      "kind": "protocol-freeze",
      "outputs": {
        "nextCommand": "python3 scripts/validate_v3_workflow_scenarios.py",
        "status": "recorded"
      },
      "phaseId": "phase-0"
    },
    {
      "evidenceRefs": [
        {
          "kind": "scenario",
          "label": "scenario",
          "ref": "v3/examples/workflow/scenarios/v3-workflow-calibration.scenario.json"
        }
      ],
      "kind": "initial-attempt",
      "outputs": {
        "nextCommand": "python3 scripts/validate_v3_workflow_scenarios.py",
        "status": "recorded"
      },
      "phaseId": "phase-1"
    },
    {
      "evidenceRefs": [
        {
          "kind": "scenario",
          "label": "scenario",
          "ref": "v3/examples/workflow/scenarios/v3-workflow-calibration.scenario.json"
        }
      ],
      "kind": "context-wipe-recovery",
      "outputs": {
        "nextCommand": "python3 scripts/validate_v3_workflow_scenarios.py",
        "status": "recorded"
      },
      "phaseId": "phase-2"
    },
    {
      "evidenceRefs": [
        {
          "kind": "scenario",
          "label": "scenario",
          "ref": "v3/examples/workflow/scenarios/v3-workflow-calibration.scenario.json"
        }
      ],
      "feedbackDecisions": [
        {
          "decision": "accepted",
          "evidenceRef": "v3/examples/workflow/scenarios/v3-workflow-calibration.scenario.json",
          "feedbackId": "fb-mech-01",
          "rationale": "Exact enum failure is valid artifact feedback."
        },
        {
          "decision": "accepted",
          "evidenceRef": "v3/VISUAL_RUBRIC.md",
          "feedbackId": "fb-visual-01",
          "rationale": "Missing native capture blocks only visual ranking."
        },
        {
          "decision": "rejected_with_reason",
          "evidenceRef": "v3/2000m.driver.v3.md",
          "feedbackId": "fb-mislead-01",
          "rationale": "Frozen enum set disallows adding a new obstacle type."
        },
        {
          "decision": "needs_owner_taste_gate",
          "evidenceRef": "v3/EVIDENCE_AND_CLAIMS.md",
          "feedbackId": "fb-ambig-01",
          "rationale": "Color preference is taste and separate from mechanical score."
        },
        {
          "decision": "needs_scorer_inspection",
          "evidenceRef": "v3/WORKFLOW_RESILIENCE_PROTOCOL.md",
          "feedbackId": "fb-stale-01",
          "rationale": "Lane C/controller behavior is disabled in v3 scope."
        },
        {
          "decision": "accepted",
          "evidenceRef": "v3/MECHANICAL_AC_SPEC.md",
          "feedbackId": "fb-scorer-01",
          "rationale": "Use exact failed ACs without editing scorer fixtures."
        }
      ],
      "kind": "reviewer-injection",
      "outputs": {
        "nextCommand": "python3 scripts/validate_v3_workflow_scenarios.py",
        "status": "recorded"
      },
      "phaseId": "phase-3"
    },
    {
      "evidenceRefs": [
        {
          "kind": "scenario",
          "label": "scenario",
          "ref": "v3/examples/workflow/scenarios/v3-workflow-calibration.scenario.json"
        }
      ],
      "kind": "regression-trap",
      "outputs": {
        "nextCommand": "python3 scripts/validate_v3_workflow_scenarios.py",
        "status": "recorded"
      },
      "phaseId": "phase-4"
    },
    {
      "evidenceRefs": [
        {
          "kind": "scenario",
          "label": "scenario",
          "ref": "v3/examples/workflow/scenarios/v3-workflow-calibration.scenario.json"
        }
      ],
      "kind": "stale-or-impossible-requirement",
      "outputs": {
        "nextCommand": "python3 scripts/validate_v3_workflow_scenarios.py",
        "status": "recorded"
      },
      "phaseId": "phase-5"
    },
    {
      "evidenceRefs": [
        {
          "kind": "scenario",
          "label": "scenario",
          "ref": "v3/examples/workflow/scenarios/v3-workflow-calibration.scenario.json"
        }
      ],
      "kind": "final-handoff",
      "outputs": {
        "nextCommand": "python3 scripts/validate_v3_workflow_scenarios.py",
        "status": "recorded"
      },
      "phaseId": "phase-6"
    }
  ],
  "protocolFreeze": {
    "changedAfterLiveResults": false,
    "frozen": true,
    "frozenCampaignRef": "v3/examples/valid/campaign.foundation.json",
    "scorerMutationObserved": false
  },
  "scenarioId": "v3-workflow-calibration",
  "schemaVersion": "2000m.v3.run-record.v1",
  "taskSeed": 101,
  "visual": {
    "blockReason": "none",
    "captureCommandResultRef": "v3/examples/workflow/evidence/capture-command.complete.json",
    "ranked": true,
    "visualPackageRef": "v3/examples/valid/visual-package.foundation.json"
  },
  "workflow": {
    "contextWipeStatus": "passed",
    "feedbackDecisionStatus": "passed",
    "handoffStatus": "passed",
    "regressionStatus": "passed"
  }
}
